{
  "pluginId": "javelin-wg",
  "type": "insecticide",
  "displayName": "Javelin WG (Certis Bt kurstaki)",
  "version": "1.0.1",
  "epaRegistrationNumber": "70051-66",
  "defaultUnit": "lb",
  "formulation": "WG",
  "activeIngredients": [
    {
      "name": "Bacillus thuringiensis kurstaki",
      "iracGroup": "11A"
    }
  ],
  "reEntryIntervalHours": 4,
  "preHarvestIntervalDays": 0,
  "ratePerAcre": {
    "amount": 1,
    "unit": "lb"
  },
  "targetPests": [
    "cabbage looper",
    "diamondback moth",
    "imported cabbage worm",
    "armyworm"
  ],
  "pollinatorRisk": "none",
  "pollinator": {"beeToxicity":"unknown","bloomRestriction":"none"},
  "notes": "Bt IRAC 11A — alternate to DiPel.",
  "complianceFlags": {
    "nonGmoCompliant": true
  },
  "pluginSchemaVersion": "1.1",
  "scoutingThresholds": [
    {
      "pest": "cabbage looper",
      "metric": "count-per-plant",
      "threshold": 0.5
    },
    {
      "pest": "diamondback moth",
      "metric": "count-per-plant",
      "threshold": 0.3
    }
  ]
}
