{
  "pluginId": "avaunt-evo",
  "type": "insecticide",
  "displayName": "Avaunt eVo (FMC indoxacarb)",
  "version": "1.0.0",
  "formulation": "WDG",
  "epaRegistrationNumber": "279-9629",
  "defaultUnit": "oz",
  "activeIngredients": [
    {
      "name": "indoxacarb",
      "iracGroup": "22A"
    }
  ],
  "reEntryIntervalHours": 12,
  "preHarvestIntervalDays": 3,
  "ratePerAcre": {
    "amount": 6,
    "unit": "oz"
  },
  "targetPests": [
    "plum curculio",
    "codling moth",
    "oriental fruit moth",
    "armyworm",
    "cabbage looper",
    "diamondback moth"
  ],
  "pollinatorRisk": "high",
  "pollinator": {"beeToxicity":"highly-toxic","bloomRestriction":"dusk-to-dawn-only"},
  "notes": "Oxadiazine IRAC 22. Apple / pear orchard + vegetable. Pro-insecticide — slow gut activity.",
  "complianceFlags": {
    "omriListed": false,
    "certifiedOrganicAllowed": false,
    "nonGmoCompliant": true,
    "transitioningAllowed": false
  },
  "pluginSchemaVersion": "1.1",
  "scoutingThresholds": [
    {
      "pest": "plum curculio",
      "metric": "pct-infested-plants",
      "threshold": 2
    },
    {
      "pest": "codling moth",
      "metric": "count-per-trap-per-week",
      "threshold": 5
    },
    {
      "pest": "cabbage looper",
      "metric": "count-per-plant",
      "threshold": 0.5
    },
    {
      "pest": "diamondback moth",
      "metric": "count-per-plant",
      "threshold": 0.3
    }
  ]
}
