{
  "pluginId": "movento",
  "type": "insecticide",
  "displayName": "Movento (Bayer spirotetramat)",
  "version": "1.0.0",
  "formulation": "SC",
  "epaRegistrationNumber": "264-1050",
  "defaultUnit": "fl-oz",
  "activeIngredients": [
    {
      "name": "spirotetramat",
      "iracGroup": "23"
    }
  ],
  "reEntryIntervalHours": 24,
  "preHarvestIntervalDays": 7,
  "ratePerAcre": {
    "amount": 6,
    "unit": "fl-oz"
  },
  "targetPests": [
    "aphid",
    "scale",
    "mealybug",
    "psyllid",
    "phylloxera"
  ],
  "pollinatorRisk": "moderate",
  "pollinator": {"beeToxicity":"toxic","bloomRestriction":"prohibited-during-bloom"},
  "notes": "Tetronic IRAC 23 — fully systemic, bidirectional. Slow-acting but suppresses scale + below-ground pests.",
  "complianceFlags": {
    "omriListed": false,
    "certifiedOrganicAllowed": false,
    "nonGmoCompliant": true,
    "transitioningAllowed": false
  },
  "pluginSchemaVersion": "1.1",
  "scoutingThresholds": [
    {
      "pest": "aphid",
      "metric": "count-per-leaf",
      "threshold": 50,
      "warnAt": 30
    }
  ]
}
