{
  "pluginId": "radiant-sc",
  "type": "insecticide",
  "displayName": "Radiant SC (Corteva spinetoram)",
  "version": "1.0.0",
  "epaRegistrationNumber": "62719-545",
  "defaultUnit": "fl-oz",
  "formulation": "SC",
  "activeIngredients": [
    {
      "name": "spinetoram",
      "iracGroup": "5"
    }
  ],
  "reEntryIntervalHours": 4,
  "preHarvestIntervalDays": 1,
  "ratePerAcre": {
    "amount": 8,
    "unit": "fl-oz"
  },
  "targetPests": [
    "thrips",
    "leafminer",
    "diamondback moth",
    "armyworm",
    "cabbage looper",
    "spotted-wing drosophila"
  ],
  "pollinatorRisk": "high",
  "pollinator": {"beeToxicity":"highly-toxic","bloomRestriction":"dusk-to-dawn-only","residualToxicityHours":3},
  "notes": "Spinosyn IRAC 5 — semi-systemic. SWD-active in berry crops. Avoid bloom or apply at sunset.",
  "complianceFlags": {
    "omriListed": false,
    "certifiedOrganicAllowed": false,
    "nonGmoCompliant": true,
    "transitioningAllowed": false
  },
  "pluginSchemaVersion": "1.1",
  "scoutingThresholds": [
    {
      "pest": "thrips",
      "metric": "count-per-leaf",
      "threshold": 4,
      "warnAt": 2
    },
    {
      "pest": "leafminer",
      "metric": "count-per-leaf",
      "threshold": 5,
      "warnAt": 3
    },
    {
      "pest": "diamondback moth",
      "metric": "count-per-plant",
      "threshold": 0.3
    },
    {
      "pest": "cabbage looper",
      "metric": "count-per-plant",
      "threshold": 0.5
    }
  ]
}
