{
  "pluginId": "azaguard",
  "type": "insecticide",
  "version": "1.0.1",
  "formulation": "EC",
  "defaultUnit": "fl-oz",
  "pluginSchemaVersion": "1.1",
  "displayName": "AzaGuard (Azadirachtin 3%)",
  "activeIngredients": [
    {
      "name": "azadirachtin",
      "iracGroup": "UN"
    }
  ],
  "ratePerAcre": {
    "amount": 16,
    "unit": "fl-oz"
  },
  "gpaCalibration": 30,
  "reEntryIntervalHours": 4,
  "preHarvestIntervalDays": 0,
  "pollinatorRisk": "low",
  "pollinator": {"beeToxicity":"unknown","bloomRestriction":"none"},
  "epaRegistrationNumber": "70299-17",
  "targetPests": [
    "aphid",
    "whitefly",
    "thrips",
    "leafminer",
    "fungus gnat",
    "Colorado potato beetle"
  ],
  "complianceFlags": {
    "nonGmoCompliant": true
  },
  "notes": "BioSafe Systems neem-derived insect growth regulator. Disrupts molting, repels feeding, suppresses oviposition.",
  "scoutingThresholds": [
    {
      "pest": "aphid",
      "metric": "count-per-leaf",
      "threshold": 50,
      "warnAt": 30
    },
    {
      "pest": "whitefly",
      "metric": "count-per-leaf",
      "threshold": 5,
      "warnAt": 3
    },
    {
      "pest": "thrips",
      "metric": "count-per-leaf",
      "threshold": 4,
      "warnAt": 2
    },
    {
      "pest": "leafminer",
      "metric": "count-per-leaf",
      "threshold": 5,
      "warnAt": 3
    },
    {
      "pest": "Colorado potato beetle",
      "metric": "count-per-plant",
      "threshold": 2,
      "warnAt": 1
    }
  ]
}
