{
  "pluginId": "m-pede-organic",
  "type": "insecticide",
  "version": "1.0.0",
  "defaultUnit": "fl-oz",
  "pluginSchemaVersion": "1.1",
  "displayName": "M-Pede Organic (potassium salts of fatty acids, OMRI)",
  "activeIngredients": [
    {
      "name": "potassium salts of fatty acids",
      "iracGroup": "UN"
    }
  ],
  "ratePerAcre": {
    "amount": 2,
    "unit": "qt"
  },
  "gpaCalibration": 30,
  "reEntryIntervalHours": 12,
  "preHarvestIntervalDays": 0,
  "pollinatorRisk": "low",
  "pollinator": {"beeToxicity":"unknown","bloomRestriction":"none"},
  "epaRegistrationNumber": "53219-6",
  "targetPests": [
    "aphid",
    "whitefly",
    "spider mite",
    "thrips",
    "psyllid"
  ],
  "complianceFlags": {
    "omriListed": true,
    "nonGmoCompliant": true,
    "certifiedOrganicAllowed": true,
    "transitioningAllowed": true
  },
  "notes": "Gowan insecticidal soap, OMRI-formulated alternative to conventional M-Pede.",
  "scoutingThresholds": [
    {
      "pest": "aphid",
      "metric": "count-per-leaf",
      "threshold": 50,
      "warnAt": 30
    },
    {
      "pest": "whitefly",
      "metric": "count-per-leaf",
      "threshold": 5,
      "warnAt": 3
    },
    {
      "pest": "spider mite",
      "metric": "count-per-leaf",
      "threshold": 10,
      "warnAt": 5
    },
    {
      "pest": "thrips",
      "metric": "count-per-leaf",
      "threshold": 4,
      "warnAt": 2
    }
  ]
}
