{
  "pluginId": "botanigard-es-beauveria",
  "type": "insecticide",
  "version": "1.0.0",
  "defaultUnit": "fl-oz",
  "formulation": "ES",
  "pluginSchemaVersion": "1.1",
  "displayName": "BotaniGard ES (Beauveria bassiana GHA, OMRI)",
  "activeIngredients": [
    {
      "name": "Beauveria bassiana strain GHA",
      "iracGroup": "UNF"
    }
  ],
  "ratePerAcre": {
    "amount": 1,
    "unit": "qt"
  },
  "gpaCalibration": 30,
  "reEntryIntervalHours": 4,
  "preHarvestIntervalDays": 0,
  "pollinatorRisk": "moderate",
  "pollinator": {"beeToxicity":"toxic","bloomRestriction":"dusk-to-dawn-only"},
  "epaRegistrationNumber": "82074-2",
  "targetPests": [
    "whitefly",
    "aphid",
    "thrips",
    "psyllid",
    "spider mite suppression"
  ],
  "complianceFlags": {
    "omriListed": true,
    "nonGmoCompliant": true,
    "certifiedOrganicAllowed": true,
    "transitioningAllowed": true
  },
  "notes": "LAM International emulsifiable suspension B. bassiana GHA. Sister to Mycotrol with different formulation.",
  "scoutingThresholds": [
    {
      "pest": "whitefly",
      "metric": "count-per-leaf",
      "threshold": 5,
      "warnAt": 3
    },
    {
      "pest": "aphid",
      "metric": "count-per-leaf",
      "threshold": 50,
      "warnAt": 30
    },
    {
      "pest": "thrips",
      "metric": "count-per-leaf",
      "threshold": 4,
      "warnAt": 2
    },
    {
      "pest": "spider mite suppression",
      "metric": "count-per-leaf",
      "threshold": 10,
      "warnAt": 5
    }
  ]
}
