{
  "pluginId": "dimethoate-4ec",
  "type": "insecticide",
  "version": "1.0.0",
  "defaultUnit": "fl-oz",
  "formulation": "EC",
  "pluginSchemaVersion": "1.1",
  "displayName": "Dimethoate 4EC (organophosphate)",
  "activeIngredients": [
    {
      "name": "dimethoate",
      "iracGroup": "1B"
    }
  ],
  "ratePerAcre": {
    "amount": 1,
    "unit": "pt"
  },
  "gpaCalibration": 30,
  "reEntryIntervalHours": 48,
  "preHarvestIntervalDays": 14,
  "pollinatorRisk": "high",
  "epaRegistrationNumber": "5905-368",
  "targetPests": [
    "aphid",
    "leafminer",
    "mite suppression",
    "thrips"
  ],
  "notes": "Loveland Products organophosphate (IRAC 1B). Systemic activity. Restricted Use in some states.",
  "scoutingThresholds": [
    {
      "pest": "aphid",
      "metric": "count-per-leaf",
      "threshold": 50,
      "warnAt": 30
    },
    {
      "pest": "leafminer",
      "metric": "count-per-leaf",
      "threshold": 5,
      "warnAt": 3
    },
    {
      "pest": "mite suppression",
      "metric": "count-per-leaf",
      "threshold": 10,
      "warnAt": 5
    },
    {
      "pest": "thrips",
      "metric": "count-per-leaf",
      "threshold": 4,
      "warnAt": 2
    }
  ]
}
