{
  "pluginId": "deadline-mps-metaldehyde",
  "type": "insecticide",
  "version": "1.0.1",
  "complianceFlags": {"omriListed": false, "certifiedOrganicAllowed": false, "notes": "No NOP listing on the OMRI Products List (searched 2026-09-25: 'Deadline' - no Deadline product among 13 NOP results; 'metaldehyde' - 0 results). Conventional metaldehyde bait; the label (EPA 5481-507, 2015-03-03) makes no organic statement."},
  "formulation": "G",
  "defaultUnit": "lb",
  "pluginSchemaVersion": "1.1",
  "displayName": "Deadline M-Ps (metaldehyde slug/snail bait)",
  "activeIngredients": [
    {
      "name": "metaldehyde",
      "iracGroup": "UN"
    }
  ],
  "ratePerAcre": {
    "amount": 10,
    "unit": "lb"
  },
  "reEntryIntervalHours": 24,
  "preHarvestIntervalDays": 21,
  "pollinatorRisk": "low",
  "pollinator": {"beeToxicity":"unknown","bloomRestriction":"none"},
  "epaRegistrationNumber": "5481-507",
  "targetPests": [
    "gray field slug",
    "European brown garden snail"
  ],
  "notes": "AMVAC conventional slug and snail bait. Faster knockdown than iron phosphate. Toxic to dogs."
}