{
  "pluginId": "dipel-df",
  "type": "insecticide",
  "displayName": "DiPel DF (Valent Bt kurstaki)",
  "version": "1.0.2",
  "epaRegistrationNumber": "73049-39",
  "defaultUnit": "lb",
  "formulation": "DF",
  "activeIngredients": [
    {
      "name": "Bacillus thuringiensis kurstaki",
      "iracGroup": "11A"
    }
  ],
  "reEntryIntervalHours": 4,
  "preHarvestIntervalDays": 0,
  "ratePerAcre": {
    "amount": 1,
    "unit": "lb"
  },
  "targetPests": [
    "cabbage looper",
    "diamondback moth",
    "imported cabbage worm",
    "armyworm",
    "tomato hornworm"
  ],
  "pollinatorRisk": "none",
  "pollinator": {"beeToxicity":"unknown","bloomRestriction":"none"},
  "notes": "Bt IRAC 11A. Caterpillar-only — no broadleaf insect activity. Eat-to-kill, slow but selective.",
  "complianceFlags": {
    "omriListed": true,
    "certifiedOrganicAllowed": true,
    "transitioningAllowed": true,
    "nonGmoCompliant": true
  },
  "pluginSchemaVersion": "1.1",
  "scoutingThresholds": [
    {
      "pest": "cabbage looper",
      "metric": "count-per-plant",
      "threshold": 0.5
    },
    {
      "pest": "diamondback moth",
      "metric": "count-per-plant",
      "threshold": 0.3
    },
    {
      "pest": "tomato hornworm",
      "metric": "count-per-plant",
      "threshold": 1
    }
  ]
}
